id,description,title,created,Company Name,salary_max,salary_min,city,has_python,has_sql,has_excel,has_powerbi,has_tableau
5744868780,"Data Analyst Location: Remote/Bangalore Amicus Therapeutics is a global, patient-dedicated biotechnology company focused on discovering, developing, and delivering high-quality medicines for people living with rare metabolic diseases. Position Summary Data analyst responsibilities include conducting full lifecycle analysis to include requirements, activities and design. Data analysts will develop analysis and reporting capabilities. They will also monitor performance and quality control plans t…",Data Analyst,2026-05-30 02:27:15+00:00,Amicus India,,,Bangalore,False,False,False,False,False
4514376189,"Job Title Data Analyst Job Brief The successful candidate will turn data into information, information into insight and insight into business decisions. Data Analyst Job Duties Data analyst responsibilities include conducting full lifecycle analysis to include requirements, activities and design. Data analysts will develop analysis and reporting capabilities. They will also monitor performance and quality control plans to identify improvements. Responsibilities ● Interpret data, analyze results…",Data Analyst,2024-01-07 15:07:49+00:00,Qrata,1300000.0,800000.0,Delhi,False,False,False,False,False
5726293535,"Job Description Role Overview: We are looking for an experienced Data Business Analyst with strong exposure to Snowflake and Databricks who can work closely with business stakeholders and analytics teams.Job Title: Data Business Analyst Key Skills & Experience: 5 years of experience as a Business Analyst / Data Business Analyst Strong hands-on experience with Snowflake and Databricks Advanced SQL skills for data analysis and validation Experience with data pipelines, ETL processes , and data qu…",Data Analyst,2026-05-12 05:45:42+00:00,Leading Client,,,Hyderabad,False,True,False,False,False
5586444744,"About the Job We are looking for a Data Analyst who is a self-starter with the ability to work in a fast-paced, performance driven environment. The incumbent will be responsible for the analysis and reporting of operational related data in an on-going effort to increase visibility for program performance. As Data Analyst, You Will… Collect, analyze, evaluate and report data in order to increase visibility into performance for all lines of business within 24-7 Intouch Complete projects and ad-ho…",Data Analyst,2026-01-16 00:31:50+00:00,InTouch CX,,,Hyderabad,False,False,False,False,False
5690242267,"Job Description Key Skills: Data Analyst, Data Analysis, Python, Product Owner, SQL Roles and Responsibilities: Analyze and interpret complex datasets related to marketing performance and customer engagement. Collaborate with Product Owners to understand business objectives and translate them into data-driven insights. Use Python and ANSI-SQL for data extraction, manipulation, and advanced analysis. Merge data from multiple source systems while ensuring data accuracy and consistency. Clean, tra…",Data Analyst,2026-04-05 03:36:04+00:00,Careernet,,,other/state only,True,True,False,False,False
5728436260,"Job Description: Job Title: Data Analyst Job Description: We are looking for a skilled Data Analyst to collect, analyze, and interpret large datasets to help drive business decisions. The ideal candidate will have strong analytical skills, attention to detail, and experience with data visualization tools. Key Responsibilities: Analyze data to identify trends and insights. Create dashboards and reports for internal stakeholders. Collaborate with teams to understand data needs. Ensure data accura…",Data analyst,2026-05-14 02:27:02+00:00,RECEX,,,Kolkata,False,False,False,False,False
4966721625,"Job Title : Data Analyst-Fintech Job Description : We are seeking a highly motivated and detail-oriented Data Analyst with 2 to 4 years of work experience to join our team. The ideal candidate will have a strong analytical mindset, excellent problem-solving skills, and a passion for transforming data into actionable insights. In this role, you will play a pivotal role in gathering, analyzing, and interpreting data to support informed decision-making and drive business growth. Key Responsibiliti…",Data Analyst,2024-12-07 13:03:54+00:00,Fatakpay,1500000.0,800000.0,other/state only,False,False,True,False,False
5784727356,"Job Description: We are seeking a talented and motivated Data Analyst to join our team. The ideal candidate will have a passion for data, a strong analytical mindset, and the ability to derive insights that drive business decisions. As a Data Analyst, you will be responsible for collecting, analyzing, and interpreting large datasets to provide actionable insights to various stakeholders across the organization. Key Responsibilities: Data Collection and Cleaning: Collect and clean data from vari…",Data analyst,2026-07-02 07:16:47+00:00,Cars24,,,Pune,False,False,False,False,False
5762314798,"Job Title: Data Analyst Location: Delhi Job Type: Full-Time (On-Site) About Us: Hubhopper is a leading podcasting platform dedicated to empowering content creators and providing the best listening experience for our users. We are seeking a talented Data Analyst to join our team and help us gain valuable insights from our data to enhance our platform further. Job Description: As a Data Analyst at Hubhopper, you will play a crucial role in analyzing and interpreting data to drive data-informed de…",Data Analyst,2026-06-13 14:22:17+00:00,Hubhopper,,,Delhi,False,False,False,False,False
5759283741,"Job description Job Description: We are seeking a talented and motivated Data Analyst to join our team. The ideal candidate will have a passion for data, a strong analytical mindset, and the ability to derive insights that drive business decisions. As a Data Analyst, you will be responsible for collecting, analyzing, and interpreting large datasets to provide actionable insights to various stakeholders across the organization. Key Responsibilities: Data Collection and Cleaning: Collect and clea…",Data analyst,2026-06-11 06:50:59+00:00,Cars24 Services Private Limited,,,Pune,False,False,False,False,False
1171509680,"MaGIC Technology and Product team is looking for a data analyst to help expand and improve data on startups, investors, and founders in the ASEAN region. As part of the data team on our Startup Database product, you will assist in maintaining the accuracy of information on startups and investors, and continuously update our repository with latest publicly available data on the same. The job offers a high degree of autonomy and will also see you playing a leading role in the analysis of the data…",Data Analyst,2019-06-05 21:12:29+00:00,Malaysian Global Innovation and Creativity Centre,1000000.0,500000.0,other/state only,False,False,False,False,False
5727098377,"Job Description: Key Responsibilities  Assist in extracting, cleaning, and analyzing datasets using SQL and Python.  Develop and maintain dashboards and reports using Power BI, Looker Studio, or other BI tools.  Support the team in data validation, quality checks, and troubleshooting.  Collaborate with senior data analysts and business teams to understand requirements and deliver insights.  Perform exploratory data analysis (EDA) to identify trends, patterns, and anomalies.  Automate recu…",Data Analyst,2026-05-13 01:59:29+00:00,Navrang HR Solutions,,,Surat,True,True,False,True,False
5586566169,"About the Job Join us in transforming the perception of customer service! We are seeking a dedicated Data Analyst to analyze and report on operational data, enhancing program performance visibility. This role is vital in contributing to various projects and performing ad-hoc analyses, providing timely insights that support strategic decision-making. If you are passionate about data and eager to make a significant impact, we invite you to apply! As Data Analyst, You Will… Collect and organize la…",Data Analyst,2026-01-16 00:45:45+00:00,In Touch,,,Hyderabad,False,False,False,False,False
5724515432,"Techwave , we are always in an exercise to foster a culture of growth, and inclusivity. We ensure whoever is associated with the brand is being challenged at every step and is provided with all the necessary opportunities to excel in life. People are at the core of everything we do. Who are we? Techwave is a leading global IT and engineering services and solutions company revolutionizing digital transformations. We believe in enabling clients to maximize the potential and achieve a greater mark…",Data Analyst,2026-05-10 02:24:12+00:00,Techwave Consulting India Private,,,other/state only,False,False,True,False,False
1712428599,"About the Role The following Job Specification is intended to reflect the nature, range and context of the work. It identifies the main requirements of the job but is not an exhaustive list of duties. The Data Analyst role is a vital role as to be a sole point of contact responsible for closely working with various teams internally and closely working with the CTO. This role typically requires the resource to analyse the vast number of datasets and provide a meaningful impact and the result of …",Data Analyst,2020-09-19 01:45:32+00:00,Namaste Credit,1000000.0,500000.0,Bangalore,False,False,False,False,False
5503836577,"About the Role We are looking for a highly skilled Data Analyst or Data Scientist with strong expertise in Python and SQL to join our client’s team. The primary responsibility will be to automate data-driven workflows and processes based on detailed business steps provided by the Product and Business teams. The ideal candidate will bridge the gap between analytics, process understanding, and automation execution. Key Responsibilities ● Collaborate with the Business and Product teams to understa…",Data Analyst,2025-11-20 00:58:08+00:00,NAVVYASA CONSULTING PRIVATE LIMITED,,,other/state only,True,True,False,False,False
5728461087,"Summary: We are seeking a skilled Data Analyst to join our team in India. In this role, you will analyse complex data sets to help drive business decisions. Ideal candidates will have a strong analytical mindset and experience with data visualisation tools. This is a great opportunity to contribute to impactful projects and grow your career in data analysis. Responsibilities: – Collect, process, and perform statistical analyses on large data sets. – Create data visualisations to present finding…",Data Analyst,2026-05-14 02:29:10+00:00,The Simpsons,,,other/state only,False,False,False,False,False
5586642440,"About the Job We are revolutionizing the way people perceive customer service, and we require your assistance! We are currently seeking a Data Analyst who will be responsible for analyzing and reporting on operational data in an effort to enhance program performance visibility. This role will also contribute to various projects and perform ad-hoc analyses to provide timely information and support for strategic decision-making. As Data Analyst, You Will… Continuously monitor and evaluate data to…",Data Analyst,2026-01-16 00:52:21+00:00,InTouch CX,,,Hyderabad,False,False,False,False,False
2500155500,"We at Reality Premedia pvt ltd is looking for Data Analyst for Pune location. Must have experience in BFSC domain. Exp- Min 3yrs Location- Pune Mandatory Skills- Exp in powerBI/Tableau, SQL Basic Python Skills:- Tableau, PowerBI and Data Analytics",Data Analyst,2021-09-29 05:01:45+00:00,Reality Premedia Services Pvt Ltd,800000.0,,Pune,True,True,False,True,True
5503284671,"Data Analyst – Job Decription Connecting people with each other and the right information is mission critical. Our Company develops innovative cloud-based technology to make it easier, more effective and more efficient to make the right connections. Our solutions put people in sync with each other and the right information, so they gain the insight needed to reach better decisions on the issues that matter most. We do it with a laser focus on reliability. The Company is a leading provider of te…",Data Analyst,2025-11-19 22:19:09+00:00,Intelliatx Therapeutics,,,Bangalore,False,False,False,False,False
4993547435,"Job Description: Data Analyst Position: Data Analyst Location: Gurgaon Experience Level: 1-3 Years Employment Type: Full-Time Role Overview We are looking for a results-driven Data Analyst to join our team and support business decision-making through data insights and analytics. The ideal candidate will be highly proficient in Python, skilled in data visualization tools, and experienced in solving complex problems to drive measurable business outcomes such as revenue growth or cost reduction. K…",Data Analyst,2025-01-01 11:53:10+00:00,RegisterKaro,1000000.0,400000.0,other/state only,True,False,False,False,False
2247134476,"The Data Analyst in the CoE will provide end to end solution development, working in conjunction with the Domain Leads and Technology Partners. He is responsible for the delivery of solutions and solution changes which are driven by the business requirements as well as providing technical and development capabilities. Knowledge Skills:- Apache Synapse, SQL, SAP MDG ( Master Data Governance), Python and Data Analytics",Data Analyst,2021-06-12 12:42:07+00:00,Indium Software,800000.0,250000.0,other/state only,True,True,False,False,False
5532438214,"Sagility combines industry-leading technology and transformation-driven BPM services with decades of healthcare domain expertise to help clients draw closer to their members. The company optimizes the entire member/patient experience through service offerings for clinical, case management, member engagement, provider solutions, payment integrity, claims cost containment, and analytics. Sagility has more than 25,000 employees across 5 countries. ""To conduct data analysis, provide insights, and c…",Data Analyst,2025-12-07 22:44:33+00:00,Sagility,,,other/state only,False,False,False,False,False
5793185629,"At Ecolab, you can help take on some of the world’s most meaningful challenges, delivering critical insights and innovative solutions to help our customers achieve clean water, safe food, abundant energy and healthy environments. With our worldwide reach and ambitious growth plans, you will have the opportunity to own your future and impact what matters. Are you ready to make an impact? Ecolab is searching for a driven Data Analyst for our Enterprise Growth Operations Team in Pune, India . The …",Data Analyst,2026-07-09 03:05:51+00:00,Ecolab,,,other/state only,False,False,False,False,False
5336689191,"We’re seeking a detail-oriented Data Analyst with proven experience in corporate settings to transform raw data into actionable insights. You’ll collaborate across departments to support strategic decision-making, optimize operations, and enhance business performance through data-driven analysis. Skills:- PowerBI, Tableau, Data Analytics, Dashboard, MS-Office, Data Visualization and Advanced analytics",Data Analyst,2025-08-04 05:33:07+00:00,EWU,700000.0,400000.0,Coimbatore,False,False,False,True,True
5637668857,"Data Analyst - Enterprise Data Management Location: Hyderabad, India About the Role: We are seeking an experienced Data Analyst to join our Enterprise Data Management team, with a core focus on Data Quality, Data Governance, and Master Data Management (MDM). In this role, you will be responsible for analyzing, profiling, and enhancing data within critical enterprise applications, including Salesforce, Oracle ERP, and Marketo. A key part of your responsibilities involves establishing and maintai…",Data Analyst,2026-02-20 13:15:56+00:00,Cornerstone onDemand,,,Pune,False,False,False,False,False
5637668856,"Data Analyst - Enterprise Data Management Location: Hyderabad, India About the Role: We are seeking an experienced Data Analyst to join our Enterprise Data Management team, with a core focus on Data Quality, Data Governance, and Master Data Management (MDM). In this role, you will be responsible for analyzing, profiling, and enhancing data within critical enterprise applications, including Salesforce, Oracle ERP, and Marketo. A key part of your responsibilities involves establishing and maintai…",Data Analyst,2026-02-20 13:15:56+00:00,Cornerstone onDemand,,,Hyderabad,False,False,False,False,False
4855397054,"Job Title: Data Analyst Location: Permanent Work from Home Job Type: Full-Time Job Description: We are seeking a highly motivated and skilled Data Analyst to join our team. The ideal candidate will have a strong background in data analysis, incident management, and real-time data reporting. The role demands exceptional communication skills, both written and spoken, as well as the ability to work flexible shifts to support our global operations. Key Responsibilities: - Perform data analysis to i…",data analyst,2024-09-07 11:25:36+00:00,Epik Solutions,700000.0,50000.0,other/state only,False,False,False,False,False
2853927974,"We are looking for a Business Intelligence (BI)/Data Analyst to create and manage Power Bl and analytics solutions that turn data into knowledge. In this role, you should have a background in data and business analysis. If you are self-directed, passionate about data, and have business acumen and problem-solving aptitude, we'd like to meet you. Ultimately, you will enhance our business intelligence system to help us make better decisions. Requirements and Qualifications BSc/BA in Computer Scien…",Data Analyst,2022-01-30 04:34:26+00:00,Multi Recruit,1400000.0,1200000.0,Bangalore,False,False,False,False,False
5781956424,"We are looking for a detail-oriented and proactive Data Analyst with around 1 year of experience in a consumer app or product-based environment. The ideal candidate should have strong analytical skills, hands-on experience with SQL and MongoDB, and the ability to work closely with cross-functional teams to drive data-informed decisions. Key Responsibilities Analyze user behavior, product performance, and business metrics for consumer applications. Write efficient SQL queries to extract, transfo…",Data Analyst,2026-06-30 14:52:26+00:00,Beworld web services,,,other/state only,False,True,False,False,False
2433361449,We are looking for a Data Analyst that oversees organisational data analytics. This will require you to design and help implement the data analytics platform that will keep the organisation running. The team will be the go-to for all data needs for the app and we are looking for a self-starter who is hands on and yet able to abstract problems and anticipate data requirements. This person should be very strong technical data analyst who can design and implement data systems on his own. Along wit…,Data Analyst,2021-09-05 02:42:02+00:00,MSMEx,1200000.0,,Mumbai,False,False,False,False,False
2449398766,"Our growing technology firm is looking for an experienced Data Analyst who is able to turn project requirements into custom-formatted data reports. The ideal candidate for this position is able to do complete life cycle data generation and outline critical information for each Project Manager. We also need someone who is able to analyze business procedures and recommend specific types of data that can be used to improve upon them. Skills:- SQL, SAP and Data Analytics",Data Analyst,2021-09-11 02:17:17+00:00,Syrencloud,800000.0,,Hyderabad,False,True,False,False,False
5728445327,"Job Description: We are seeking a skilled Data Analyst with expertise in Power BI to design and maintain interactive dashboards, analyze complex datasets, and deliver actionable insights. The ideal candidate will have experience in data visualization, report creation, and performance analysis. Strong proficiency in Power BI, SQL, and Excel is essential. The role requires excellent problem-solving abilities, attention to detail, and effective communication to present data findings to stakeholder…",Data Analyst,2026-05-14 02:27:43+00:00,RECEX,,,Delhi,False,True,True,True,False
5761950540,"Job Description- Job Summary: We are seeking a detail-oriented Data Analyst with expertise in SAS and VBA. The ideal candidate will possess strong skills in SQL, DataSteps, and dashboard creation to support our data-driven decision-making process. This role involves completing ad hoc data requests and ensuring effective data management using databases. Key Responsibilities: • Utilize SAS for data analysis and MIS reporting. • Manage and produce daily, weekly, and monthly MIS reports to track ke…",Data Analyst,2026-06-13 08:48:32+00:00,Kotak Life,,,Gurgaon,False,True,False,False,False
2890608757,"Good grasp and hands-on exposure to SQL, Hive. Good to have- Azure cloud, Spark sql. 1. Will be the point of contact for reporting/data management needs and will be responsible to drive complex data analysis and propose improvement opportunities in existing tools and reports. 2. The Data Analyst will be responsible to establish best practices in data management, data visualization, and report distribution. 3. Understanding requirements and converting into technical and business delivers. 4. Lev…",Data Analyst,2022-02-12 04:45:18+00:00,Fragma Data Systems,800000.0,600000.0,other/state only,False,True,False,False,False
4686704927,"We are Hiring for ( Data Analyst ) ( Desired Candidate Profile: Checking ) Analysis and entering data in databases working in a Emergency Control Room and working on Logistics Portal Interface and GPS, Good Communication skill (Hindi & English) Employee Condition:- · Job Location is Vadodara · Girls only work in ‘A’ and ‘B’ Shift · Bond Period is 1 Years and breach to which is strictly not allowed. Special Request / Permissions shall be reviewed for by higher management is case of relieving · R…",Data Analyst,2024-05-10 07:38:51+00:00,Not specified,,,Vadodara,False,False,False,False,False
5781141360,"Share this jobShare this job Data Analyst Arcgate is a dynamic and rapidly growing team of 2500 professionals passionate about data and technology. We partner with leading startups and enterprises to deliver solutions across data analytics, AI data preparation, quality engineering,search relevance, and more. We are currently seeking a Data Analyst to join our team. This role will play a key part in delivering high-quality data analysis and reporting to drive decision-making across client’s prod…",Data Analyst,2026-06-29 18:13:09+00:00,ARC Gate Private Limited,,,Ajmer,False,False,False,False,False
4715697356,"Must have skills 3 to 6 years Data Science SQL, Excel, Big Query - mandate 3 years Python/ML, Hadoop, Spark - 2 years Requirements • 3 years prior experience as a data analyst • Detail oriented, structural thinking and analytical mindset. • Proven analytic skills, including data analysis and data validation. • Technical writing experience in relevant areas, including queries, reports, and presentations. • Strong SQL and Excel skills with the ability to learn other analytic tools • Good communic…",Data analyst,2024-06-01 09:41:50+00:00,Sadup Softech,1500000.0,1200000.0,Bangalore,True,True,True,False,False
2403881225,Measure the sales effectiveness efforts using data science/app/digital nudges. Should be able to work on the clickstream data Should be well versed and willing to work hands-on various Machine Learning techniques Skills Ability to lead a team of 5-6 members. Ability to work with large data sets and present conclusions to key stakeholders. Develop a clear understanding of the client’s business issue to inform the best approach to the problem. Root-cause analysis Define data requirements for crea…,Data Analyst,2021-08-24 22:37:13+00:00,Multi Recruit,1500000.0,500000.0,Bangalore,False,False,False,False,False
5707412186,"About Fusemachines Founded in 2013, Fusemachines is a global provider of enterprise AI products and services, on a mission to democratize AI. Leveraging proprietary AI Studio and AI Engines, the company helps drive the clients’ AI Enterprise Transformation, regardless of where they are in their Digital AI journeys. With offices in North America, Asia, and Latin America, Fusemachines provides a suite of enterprise AI offerings and specialty services that allow organizations of any size to implem…",Data Analyst,2026-04-23 01:53:07+00:00,Fusemachines,,,other/state only,False,False,False,False,False
5769322906,"About Fusemachines Founded in 2013, Fusemachines is a global provider of enterprise AI products and services, on a mission to democratize AI. Leveraging proprietary AI Studio and AI Engines, the company helps drive the clients’ AI Enterprise Transformation, regardless of where they are in their Digital AI journeys. With offices in North America, Asia, and Latin America, Fusemachines provides a suite of enterprise AI offerings and specialty services that allow organizations of any size to implem…",Data Analyst,2026-06-19 17:24:10+00:00,Fusemachines,,,Pune,False,False,False,False,False
5681009000,"Role- Data Analyst Experience- 2 to 5 years Location-Bangalore Job Role- ● Experience: Minimum of 2 years of professional experience in a data-heavy environment (E-commerce or Fintech experience is a plus). ● SQL Mastery: Exceptional ability to write complex joins, window functions, Analytical functions, and CTEs. Experience with high-scale databases (e.g., BigQuery, Hive, or Postgres). ● Scripting: Functional knowledge of Python for data manipulation (Pandas, NumPy) and basic automation script…",Data Analyst,2026-03-28 11:28:26+00:00,Wissen Technology,,,Bangalore,True,True,False,False,False
