id,description,title,created,Company Name,salary_max,salary_min,city,has_python,has_sql,has_excel,has_powerbi,has_tableau
4665943640,"Job Responsibility: * Coordinate with CSMs to complete Pilot sales tracker, QBR Decks, End of pilot Decks *Monitor Daily Sales volume and alert CSMs of Locations with Low volume counts *Collaborate with other teammates to extract data figures, data entry (Google Sheets & Google Slides), and monitor key performance indicators (KPIs) to determine business initiatives’ success *Helping in Minor Integration Changes *Helping with Tickets and giving support when required * Basic product knowledge of …",Data Analyst,2024-04-26 16:15:16+00:00,Grubbrr systems Pvt Ltd,900000.0,300000.0,Ahmedabad,False,False,False,False,False
2577819167,"Location: Bangalore Work Timing: 5 Days A Week Responsibilities include: • Ensure right stakeholders gets right information at right time • Requirement gathering with stakeholders to understand their data requirement • Creating and deploying reports • Participate actively in datamarts design discussions • Work on both RDBMS as well as Big Data for designing BI Solutions • Write code (queries/procedures) in SQL / Hive / Drill that is both functional and elegant, following appropriate design patt…",Data Analyst,2021-10-26 04:51:56+00:00,zyoin,2100000.0,500000.0,Bangalore,False,True,False,False,False
2653476396,"Analytical tool: Redpoint Research and drawing insights Excellent written, oral and presentation skill Critical thinking and problem-solving skill Applications: SQL, Redpoint Description: Create unique fleet rich database using multi step matching rules Critical thinking in identifying record survivor ship rules for identifying master record Data roll-up at different levels, by providing linkage across databases Learn issues clients are currently facing with their dataset Foresee the problems i…",Data Analyst,2021-11-18 04:24:02+00:00,CIEL HR Services,1500000.0,,Bangalore,False,True,True,False,False
3801594068,"Primary Duties and Responsibilities Experience with Informatica Multidomain MDM 10.4 tool suite preferred Partnering with data architects and engineers to ensure an optimal data model design and implementation for each MDM domain in accordance with industry and MDM best practices Works with data governance and business steward(s) to design, develop, and configure business rules for data validation, standardize, match, and merge Implementation of Data Quality policies, procedures and standards a…",Data Analyst,2022-12-26 06:16:30+00:00,Talent500 by ANSR,3000000.0,1000000.0,Bangalore,False,False,False,False,False
3189580389,"Knowledge of database languages such as SQL, NoSQL, AWS services, linux or Python Knowledge in PowerBI Good to have knowledge in Kibana (visualization) and Kibana Development tools Analytical and problem-solving skills Proficiency in Microsoft Excel Data visualization (simple aggregation-based charts to complex geo-based visualizations) Accuracy and excellent attention to detail Strong written/verbal communication skills Qualifications and Experience 3 years’ experience in Data Analysis or rele…",Data Analyst,2022-06-02 06:13:33+00:00,Beauto Systems Private Limited,500000.0,100000.0,other/state only,True,True,True,True,False
1422966819,"Skill Set SQL, Python, Numpy,Pandas,Knowledge of Hive and Data warehousing concept will be a plus point. JD - Strong analytical skills with the ability to collect, organise, analyse and interpret trends or patterns in complex data sets and provide reports & visualisations. - Work with management to prioritise business KPIs and information needs Locate and define new process improvement opportunities. - Technical expertise with data models, database design and development, data mining and segmen…",Data Analyst,2020-01-25 17:57:23+00:00,Yulu Bikes,1200000.0,700000.0,Bangalore,True,True,False,False,False
2821621318,"What You’ll Do Synthesize data to provide actionable insights to the leadership and the product team to influence strategy and growth. Build dashboards and tools, craft analysis, and tell stories with data to help our teams make better decisions. Track user performance data and map it to key learning metrics for deeper insights Monitor the performance of new features and recommend iterations based on your findings Partner with other stakeholders to scope features that solve user problems Owners…",Data Analyst,2022-01-18 04:28:04+00:00,Humanitus Learning Science and Consultancy Pvt Limited,700000.0,500000.0,other/state only,False,False,False,False,False
1171509599,"Rocket Kommerce LLP: We are a Bangalore-based top-tier stealth-mode e-commerce enabling technology & solutions company powering several brands and leading e-commerce companies in India. Our product is a Cloud-based SaaS Inventory, Warehouse Management & Omni-Channel Solution. We have deep relationships with leading e-commerce companies in India and have processed over Rs 1500 crore of GMV. We are building out our product and technology platform and other services anticipating HUGE demand over n…",Data Analyst,2019-06-05 21:12:28+00:00,Rocket Kommerce,800000.0,500000.0,Bangalore,False,False,False,False,False
5604419908,"Must have Strong SQL skills (queries, optimization, procedures, triggers), Hands-on experience with SQL, Automated through SQL. Looking for candidates having 2 years experience who has worked on large datasets with 1cr. datasets or more. Handling the challenges and breaking. Must have Advanced Excel skills Should have 3 years of relevant experience Should have Reporting  dashboard creation experience Should have Database development & maintenance experience Must have Strong communication for cl…",Data Analyst,2026-01-29 11:29:14+00:00,Talent Pro,1200000.0,800000.0,Mumbai,False,True,True,False,False
4874338703,"About the company DCB Bank is a new generation private sector bank with 442 branches across India.It is a scheduled commercial bank regulated by the Reserve Bank of India. DCB Bank’s business segments are Retail banking, Micro SME, SME, mid-Corporate, Agriculture, Government, Public Sector, Indian Banks, Co-operative Banks and Non-Banking Finance Companies. Job Description Department : Risk Analytics CTC: Max 18 Lacs Grade: Sr Manager/AVP Experience: Min 4 years of relevant experience We are lo…",Data Analyst,2024-09-24 11:44:30+00:00,Pluginlive,2000000.0,1000000.0,Mumbai,False,False,False,False,False
4411060128,"Who we are: Stanza Living is India’s largest and fastest growing tech-enabled, managed accommodation company that delivers a hospitality-led living experience to migrant students and young working professionals across India. We have a full-stack business model that focuses on design, development and delivery of daily living solutions tailored to the young consumers’ lifestyle. From smartly-planned residences, host of amenities and services for hassle-free living to exclusive community engagemen…",Data Analyst,2023-11-03 14:48:03+00:00,Stanza Living,900000.0,600000.0,other/state only,False,False,False,False,False
5211779275,"Key qualifications 1. Bachelor’s Degree required and any other relevant academic course a plus. 2. Strong domain knowledge of investment data 3. 5 years of data management, data analytics, or data governance experience in financial services 4. Experience in data analysis, exploratory analysis using SQL and formulating data quality rules. 5. Experience working with BI reporting tools like Tableau, Power BI is preferred. 6. Knowledge in coding, Python is a plus. 7. Prior experience working with D…",Data Analyst,2025-05-23 06:51:59+00:00,Wissen Technology,,,Mumbai,True,True,False,True,True
5531896486,"Required Skills: Strong SQL Expertise, Data Reporting & Analytics, Database Development, Stakeholder & Client Communication, Independent Problem-Solving & Automation Skills Review Criteria · Must have Strong SQL skills (queries, optimization, procedures, triggers) · Must have Advanced Excel skills · Should have 3 years of relevant experience · Should have Reporting  dashboard creation experience · Should have Database development & maintenance experience · Must have Strong communication for cli…",Data Analyst,2025-12-07 05:40:05+00:00,Peak Hire Solutions,1100000.0,800000.0,Bangalore,False,True,True,False,False
5314053973,"Background Fisdom is a leading digital wealth management platform. Fisdom platform (mobile apps and web apps) provides access to consumers to a wide bouquet of financial solutions – investments, savings and protection (and many more in the pipeline). Fisdom blends cutting-edge technology with conventional financial wisdom, awesome UX and friendly customer service to make financial products simpler and more accessible to millions of Indians. We are growing and constantly looking for high perform…",Data Analyst,2025-07-21 05:27:56+00:00,Fisdom,100000.0,100000.0,Bangalore,False,False,False,False,False
5294954886,"Bachelor's degree in Computer Science, Engineering, Operations Research, Math, or related discipline. Minimum 2 years of experience as an Analyst role preferred. Highly proficient in Microsoft Office and Windows based applications. SQL AND Excel Knowledge and Hands-on experience is a must. Demonstrated Analytical ability, results-oriented environment with external customer interaction. Excellent written and verbal communication and presentation skills and the ability to express thoughts logical…",Data Analyst,2025-07-10 05:24:09+00:00,Multi Recruit,850000.0,650000.0,Bangalore,False,True,True,False,False
5731649284,"End Date Sunday 30 August 2026 We Support Flexible Working – Click here for more information on flexible working options Flexible Working Options Hybrid Working Job Description Summary Provides high quality inputs into the Data & AI strategy ensuring alignmnet between Business and Group Data & AI strategies. Coordinating and collaborating to create core materials digestable by the Group. Job Description Must have Skill - PowerBI, SQL, Group Data Warehouse, and ETL/reporting from Genesys Cloud Y…",Data Analyst,2026-05-17 02:02:18+00:00,Lloyds Bank,,,other/state only,False,True,False,True,False
5731956518,"Expertise in data analysis, computer-aided analysis, or scientific research. Proficiency in data analysis tools such as MATLAB, Excel, and Power BI is required. Expertise in data visualization tools is preferred. Familiarity with RFID systems and retail store operations is preferred. Skills: Power Bi, Data Analysis, Visualization Experience: 3.00-5.00 Years Education: Bachelor Of Technology (B.Tech/B.E)",Data Analyst,2026-05-17 06:43:12+00:00,Tessolve Semiconductor Private Limited,,,Bangalore,False,False,True,True,False
5732600161,"Description Header Description Role Description This role sits within the Risk & Compliance Product Team, working closely with the Data Discovery team. The Data Discovery team builds datasets/tables, and this role is responsible for validating those outputs before they are consumed by product use cases Location Gurgaon ( 3 days in office withno exceptions ) Experience 4-8 Years Start Date Immediate Must-Have Skills Strong SQL expertise (mandatory) Experience in Banking / Financial Services doma…",Data Analyst,2026-05-18 02:13:56+00:00,EXL,,,other/state only,False,True,False,False,False
5715478790,"As an Analyst at Tap Invest, you’ll turn data into decisions. You’ll work with teams across Product, Ops, Marketing, and Sales to uncover insights, solve real business problems, and drive strategy. This role is for someone who is comfortable working with data independently and can support business teams with reliable analysis and reporting. Key Responsibilities ● Gather, organize, and clean data from various sources including databases, spreadsheets, and external sources to ensure accuracy and …",Data Analyst,2026-05-01 11:45:52+00:00,Tap Invest,500000.0,300000.0,Bangalore,False,False,False,False,False
5731966416,"Core Skills: Data Product Development, Data Mart design Understanding of Machine Learning / Deep Learning / Time-Series / Optimization Banking Retail, Business & Wholesale Product Knowledge and understanding Communication & Inter-personal skills People Management & Multicultural awareness Technical Skills: Strong skills using Python ( R, SAS, Spark) , SQL, DAX Strong coding skills in a data programming language: Python, R, Java Cloud Data technologies Competencies: Expert-level proficiency in S…",Data Analyst,2026-05-17 06:49:57+00:00,Allime Tech Solutions,,,Pune,True,True,False,False,False
5749671387,"Description Analyze and interpret large datasets to extract meaningful insights and support decision-making processes in the business. Responsibilities Collect, clean, and analyze data, create reports and dashboards, collaborate with stakeholders on data needs, perform statistical analysis Qualifications Bachelor's/Master's in any stream 2-5 years",Data Analyst,2026-06-03 02:29:11+00:00,EXL,,,Bangalore,False,False,False,False,False
5754756171,"Job Family : EBO Management Information System (India) Travel Required : None Clearance Required : None What You Will Do : Contribute & Manage backend PMO activities (Timesheet Management, Invoice Oversight, SubK & Roster Management, Laptop/Resource Management, Expenses, EDSP & other Compliance Requirements), including project documentation, governance, and compliance tracking Develop and maintain advanced reports and dashboards using MS Excel and Power BI to deliver actionable insights Perform…",Data Analyst,2026-06-07 02:18:45+00:00,Guidehouse,,,other/state only,False,False,True,True,False
5760752150,"Overview: Join a dynamic, fast-growing team focused on healthcare data analytics. Work with large healthcare data assets to understand, manipulate, and deliver insights. Role and Responsibilities: Apply quantitative problem-solving and qualitative research to address questions in the pharmaceutical and medical device industries. Collaborate with cross-functional teams including RWD domain experts, developers, analysts, and scientists. Serve as a key client contact, maintaining strong relationsh…",Data Analyst,2026-06-12 06:53:55+00:00,Clarivate,,,Bangalore,False,False,False,False,False
5761948298,"Focus on improving processes and strategies within organizations, by analyzing data, provide actionable insights to help stakeholders make informed decisions Drive growth and bring-in business efficiency Bridge the gap between business needs and technical solutions Assist organization understand preferences and behaviors, leading to improved products, services, and engagement strategies Enable innovation by providing insights that guide the development of new products, technologies, and busines…",Data Analyst,2026-06-13 08:45:55+00:00,Jsw Steel,,,Mumbai,False,False,False,False,False
5599070754,"End Date Thursday 30 July 2026 We Support Flexible Working – Click here for more information on flexible working options Flexible Working Options Hybrid Working Job Description Summary The Data Engineer will focus on assisting in the design, development, and maintenance of Data Product pipelines, gaining practical experience whilst working under the guidance of senior data engineers.​ Job Description Must have - SQL, GCP, Python Supports and enables others to use and benefit from existing data …",Data Analyst,2026-01-25 00:57:33+00:00,Lloyds Bank,,,other/state only,True,True,False,False,False
5703925338,"Job Description Purpose of the role To enable data-driven strategic and operational decision making through extracting actionable insights from large datasets, performing statistical and advanced analytics to uncover trends and patterns, and presenting findings through clear visualisations and reports. Accountabilities Investigation and analysis of data issues related to quality, lineage, controls, and authoritative source identification, documenting data sources, methodologies, and quality fin…",Data Analyst,2026-04-19 02:02:33+00:00,Barclays,,,other/state only,False,False,False,False,False
5767896846,"Meet the Team The Customer Listening & Analytics team with Cisco’s Data and Analytics organization, owns the data infrastructure and analytical frameworks that power Cisco’s global customer experience measurement programs. Our data platform underpins NPS measurement, TAC performance analytics, executive business reviews, and customer health scoring—operating across a modern Snowflake/dbt stack with deep integration into GCP and the broader Cisco data ecosystem. We operate as a lean, high-owners…",Data Analyst,2026-06-18 15:15:46+00:00,Cisco,,,Bangalore,False,False,False,False,False
5773985012,"Shape the utilities market of the future with us! We are looking for a detail-oriented and motivated Support Associate to join our team. This role is ideal for fresh graduates (Bachelor’s/Diploma holders) who are based in Bengaluru and are eager to learn, grow, and contribute in a professional work environment. What is the role about? Key Responsibilities: Provide day-to-day operational and administrative support. Maintain and update records, reports, and documentation. Assist teams with data m…",Data Analyst,2026-06-24 02:29:01+00:00,Cuculus,,,Bangalore,False,False,False,False,False
5772912751,"Shape the utilities market of the future with us! We are looking for a detail-oriented and motivated Support Associate to join our team. This role is ideal for fresh graduates (Bachelor’s/Diploma holders) who are based in Bengaluru and are eager to learn, grow, and contribute in a professional work environment. What is the role about? Key Responsibilities: Provide day-to-day operational and administrative support. Maintain and update records, reports, and documentation. Assist teams with data m…",Data Analyst,2026-06-23 04:05:52+00:00,Cuculus GmbH,,,Bangalore,False,False,False,False,False
5774237847,"Responsibilities: Understanding the reporting requirements and provide valuable advice Continuous optimization and automation of reporting, further development of reporting tools, active management of the reporting portfolio Creation of assigned reports in time and quality Collaboration with international teams Requirements: Must have: Expertise with PowerBI/Tableau or SAP Analytics Cloud (SAC) Expertise with Microsoft Excel, Access, Powerpoint VBA programming skills for Microsoft Excel and Acc…",Data Analyst,2026-06-24 07:23:38+00:00,Caratlane,,,Pune,False,False,True,True,True
5774237848,"Dashboarding (PowerBI, Quicksight etc) - Data preprocessing, cleaning, modelling and deployment experience. Experience in software engineering Requirements engineering Hands on cloud stack experience (preferred aws) Problem solving Good Communication and presentation skills in English Requirements: Understanding of data structures Continuous learning attitude Deep learning hands on experience Building and Deploying the models Automotive data analysis knowhow Front end development and dashboardi…",Data Analyst,2026-06-24 07:23:38+00:00,Caratlane,,,Pune,False,False,False,True,False
5778451352,"Strong proficiency in SQL for data querying and analysis • Hands-on experience with Python for data analysis • Solid understanding of data modeling concepts • Experience working with BigQuery, Airflow, PySpark, and Git Good to Have • Experience with Excel / Google Sheets for analysis and validation • Exposure to BI tools such as Power BI, Tableau, or Looker • Working knowledge of statistics and analytical techniques • Familiarity with advanced analytics (regression, forecasting, experimentation…",Data Analyst,2026-06-27 07:32:41+00:00,Techcom Solutions India Private Limited,,,Bangalore,True,True,True,True,True
5778919523,Job Summary We are seeking an experienced Lead Data Engineer with 8 to 12 years of expertise in Snowflake Machine Learning Python and SQL scripting. The role involves analyzing complex datasets deriving actionable insights and contributing to data-driven decision-making in a hybrid work model with day shifts. Responsibilities Analyze large and complex datasets to identify trends patterns and actionable insights that align with business objectives Develop and maintain scalable data pipelines usi…,Data Analyst,2026-06-27 14:58:11+00:00,Cognizant,,,Kolkata,True,True,False,False,False
5780531648,"ABOUT TRIBUTE TECHNOLOGY: At Tribute Technology, we make end-of-life celebrations memorable, meaningful, and effortless through thoughtful and innovative technology solutions. Our mission is to help communities around the world celebrate life and pay tribute to those we love. Our comprehensive platform brings together software and technology to provide a fully integrated experience for all users, whether that is a family, a funeral home, or an online publisher. We are the market leader in the U…",Data Analyst,2026-06-29 02:40:35+00:00,Tribute Technology,,,Hyderabad,False,False,False,False,False
5767591298,"Meet the Team The Customer Listening & Analytics team with Cisco's Data and Analytics organization, owns the data infrastructure and analytical frameworks that power Cisco's global customer experience measurement programs. Our data platform underpins NPS measurement, TAC performance analytics, executive business reviews, and customer health scoring-operating across a modern Snowflake/dbt stack with deep integration into GCP and the broader Cisco data ecosystem. We operate as a lean, high-owners…",Data Analyst,2026-06-18 10:24:50+00:00,Cisco,,,Bangalore,False,False,False,False,False
5784728868,"Roles and Responsibilities Perform quantitative and qualitative data analysis using SQL and other tools to uncover patterns, trends, and actionable insights. Translate complex datasets into meaningful business insights, addressing the so-what and what-if questions to guide decision-making. Prepare clear, concise, and insightful reports, presentations, and dashboards for stakeholders. Collaborate with cross-functional teams to understand business needs and provide data-driven recommendations. Ma…",Data Analyst,2026-07-02 07:18:36+00:00,Tech Smcsquared Gcc,,,Bangalore,False,True,False,False,False
5771399200,"Requisition number: 2369284 Job category: Business & Data Analytics Optum is a global organization that delivers care, aided by technology to help millions of people live healthier lives. The work you do with our team will directly improve health outcomes by connecting people with the care, pharmacy benefits, data and resources they need to feel their best. Here, you will find a culture guided by inclusion, talented peers, comprehensive benefits and career development opportunities. Come make a…",Data Analyst,2026-06-21 10:34:38+00:00,UnitedHealth Group,,,Noida,False,False,False,False,False
4282822424,Job Description: Looking for someone with 2 years Strong experience over Python  SQL. Very proficient with the problem solving. Good Communication Skills. Skills:- Python,Data Analyst,2023-08-29 13:12:02+00:00,Recro,,,Bangalore,True,True,False,False,False
5778444152,"ABOUT TRIBUTE TECHNOLOGY: At Tribute Technology, we make end-of-life celebrations memorable, meaningful, and effortless through thoughtful and innovative technology solutions. Our mission is to help communities around the world celebrate life and pay tribute to those we love. Our comprehensive platform brings together software and technology to provide a fully integrated experience for all users, whether that is a family, a funeral home, or an online publisher. We are the market leader in the U…",Data Analyst,2026-06-27 07:29:56+00:00,Tribute Technology,,,Hyderabad,False,False,False,False,False
5727195252,"Job Description: Primary Role Description: - The incumbent will be a part of the advanced descriptive and predictive analytics sub-function to work on analysis/reports/dashboards related to superior risk selection, risk assessment and risk management. To help data evidence-based decision-making for the business to enable better understanding and management of the health risks. The role requires a good understanding of Health Insurance domain in India and various drivers of profitability. Respon…",Data Analyst,2026-05-13 02:09:30+00:00,Mancraft Consulting,,,Noida,False,False,False,False,False
5739982837,"About Our Company Ameriprise India LLP has been providing client based financial solutions to help clients plan and achieve their financial objectives for 20 years. We are part of Ameriprise Financial Inc., a US financial planning company headquartered in Minneapolis with a global presence and diversified financial services leader with more than $1.5 trillion in assets under management, administration and advisement as of year-end 2024. The firm’s focus areas include Asset Management and Advice…",Data Analyst,2026-05-25 02:10:04+00:00,Ameriprise,,,other/state only,False,False,False,False,False
5787185965,"Description In this position, the candidate will be responsible for building and maintaining BI and analytics solutions that transform data into actionable insights through interactive and easy-to-understand dashboards and reports. The role requires a strong background in data analysis, digital marketing analytics, and business intelligence, along with excellent analytical and communication skills. The selected candidate will work in a client-facing capacity, supporting end-to-end BI developmen…",Data Analyst,2026-07-04 02:29:39+00:00,EXL,,,other/state only,False,False,True,False,False
4686705015,"HiWelcome students, ladies, to allDo u have a free time? Do u want earnings? But u want to know genuine websites and jobs. I will guide u. Computer job nternational project u will get. If u want WhatsApp 2. Details r all in text file. U want to buy RS.150 only",Data Analyst,2024-05-10 07:38:52+00:00,Not specified,,,Chennai,False,False,False,False,False
