id,description,title,created,Company Name,salary_max,salary_min,city,has_python,has_sql,has_excel,has_powerbi,has_tableau
5785773124,"This job is with Cornerstone OnDemand, an inclusive employer and a member of myGwork – the largest global platform for the LGBTQ business community. Please do not contact the recruiter directly. Data Analyst - Enterprise Data Management Location: Hyderabad, India About the Role: We are seeking an experienced Data Analyst to join our Enterprise Data Management team , with a core focus on Data Quality, Data Governance, and Master Data Management (MDM). In this role, you will be responsible for an…",Data Analyst,2026-07-03 00:54:32+00:00,Cornerstone OnDemand,,,Pune,False,False,False,False,False
5785772963,"This job is with Capco, an inclusive employer and a member of myGwork – the largest global platform for the LGBTQ business community. Please do not contact the recruiter directly. Job Title: Data Analyst (Python Pyspark) About Us “Capco, a Wipro company, is a global technology and management consulting firm. Awarded with Consultancy of the year in the British Bank Award and has been ranked Top 100 Best Companies for Women in India 2022 by Avtar & Seramount . With our presence across 32 cities a…",Senior Data Analyst,2026-07-03 00:54:31+00:00,Capco,,,other/state only,True,False,False,False,False
5790410558,"This job is with Kyndryl, an inclusive employer and a member of myGwork – the largest global platform for the LGBTQ business community. Please do not contact the recruiter directly. Who We Are At Kyndryl, we run and reimagine the mission-critical technology systems that drive advantage for the world's leading businesses. We are at the heart of progress; with proven expertise and a continuous flow of AI-powered insight, enabling smarter decisions, faster innovation, and a lasting competitive edg…","Lead, Data Analyst",2026-07-07 05:28:43+00:00,Kyndryl,,,Bangalore,False,False,False,False,False
5785772965,"This job is with Capco, an inclusive employer and a member of myGwork – the largest global platform for the LGBTQ business community. Please do not contact the recruiter directly. Job Title: SOX Compliance About Us “Capco, a Wipro company, is a global technology and management consulting firm. Awarded with Consultancy of the year in the British Bank Award and has been ranked Top 100 Best Companies for Women in India 2022 by Avtar & Seramount . With our presence across 32 cities across globe, we…",Liquidity - Data Analyst,2026-07-03 00:54:31+00:00,Capco,,,other/state only,False,False,False,False,False
5785772186,"This job is with Capco, an inclusive employer and a member of myGwork – the largest global platform for the LGBTQ business community. Please do not contact the recruiter directly. About Us “Capco, a Wipro company, is a global technology and management consulting firm. Awarded with Consultancy of the year in the British Bank Award and has been ranked Top 100 Best Companies for Women in India 2022 by Avtar & Seramount . With our presence across 32 cities across globe, we support 100 clients acros…",Data Analyst - Data Remediation - Mumbai,2026-07-03 00:54:23+00:00,Capco,,,Mumbai,False,False,False,False,False
5785772047,"This job is with Standard Chartered Bank, an inclusive employer and a member of myGwork – the largest global platform for the LGBTQ business community. Please do not contact the recruiter directly. Job Summary Data Analyst is responsible for assisting Director CDO-CFCR-Enablement Data Product to achieve department goals. Analyst will work closely with FCCA teams and support country sensitive data mining needs and statistical analysis using various data and analytics methodologies. Analyst is re…",Associate Director Data Analyst,2026-07-03 00:54:22+00:00,Standard Chartered Bank,,,Chennai,False,False,False,False,False
5790410431,"This job is with Moody's, an inclusive employer and a member of myGwork – the largest global platform for the LGBTQ business community. Please do not contact the recruiter directly. At Moody's, we unite the brightest minds to turn today’s risks into tomorrow’s opportunities. We do this by striving to create an inclusive environment where everyone feels welcome to be who they are—with the freedom to exchange ideas, think innovatively, and listen to each other and customers in meaningful ways. Mo…",Senior Financial Data Analyst,2026-07-07 05:28:34+00:00,Moody's,,,Bangalore,False,False,False,False,False
5762611519,"ABOUT THE ROLE We are building a macro intelligence capability within our consumer business at Bajaj Consumer Care. This is a newly created, high-visibility role designed for an economist or data analyst who can read India’s macroeconomic environment and translate it into strategic insights that directly shape business decisions. You will serve as the in-house macro intelligence engine — connecting economic signals to consumer behaviour, advising leadership, and helping the organisation stay ah…",Macro Economist / Senior Data Analyst,2026-06-13 18:51:33+00:00,Bajaj Consumer Care,,,Mumbai,False,False,False,False,False
5785770935,"This job is with Criteo, an inclusive employer and a member of myGwork – the largest global platform for the LGBTQ business community. Please do not contact the recruiter directly. What You'll Do: Criteo is in search of a passionate, highly motivated Data Analyst to join our Analytics team. You will turn business requests into data problems and tackle them in a scalable and efficient way, working together with analyst teams across Criteo locations. Aside from solving business challenges, this p…","Data Analyst II, RM - AMER",2026-07-03 00:54:12+00:00,Criteo,,,Gurgaon,False,False,False,False,False
5785772431,"This job is with Moody's, an inclusive employer and a member of myGwork – the largest global platform for the LGBTQ business community. Please do not contact the recruiter directly. At Moody's, we unite the brightest minds to turn today’s risks into tomorrow’s opportunities. We do this by striving to create an inclusive environment where everyone feels welcome to be who they are—with the freedom to exchange ideas, think innovatively, and listen to each other and customers in meaningful ways. Mo…",Lead Data Analyst - Employee Experience,2026-07-03 00:54:25+00:00,Moody's,,,Bangalore,False,False,False,False,False
5785771936,"This job is with eBay, an inclusive employer and a member of myGwork – the largest global platform for the LGBTQ business community. Please do not contact the recruiter directly. At eBay, we're more than a global ecommerce leader - we're changing the way the world shops and sells. Our platform empowers millions of buyers and sellers in more than 190 markets around the world. We're committed to pushing boundaries and leaving our mark as we reinvent the future of ecommerce for enthusiasts. Our cu…","Data Science- Analyst, Search",2026-07-03 00:54:21+00:00,eBay,,,Bangalore,False,False,False,False,False
5785771675,"This job is with eBay, an inclusive employer and a member of myGwork – the largest global platform for the LGBTQ business community. Please do not contact the recruiter directly. At eBay, we're more than a global ecommerce leader - we're changing the way the world shops and sells. Our platform empowers millions of buyers and sellers in more than 190 markets around the world. We're committed to pushing boundaries and leaving our mark as we reinvent the future of ecommerce for enthusiasts. Our cu…",Competitive Data Eng & Analyst,2026-07-03 00:54:19+00:00,eBay,,,Bangalore,False,False,False,False,False
5785771371,"This job is with MSCI, an inclusive employer and a member of myGwork – the largest global platform for the LGBTQ business community. Please do not contact the recruiter directly. Your Team Responsibilities: The Geospatial Data Team manages collection operations, data quality, and best practices for Climate and ESG geospatial data. The team drives data acquisition, vendor coordination, QA engineering, process automation, and research enablement-serving as the operational backbone for MSCI's geos…",Geospatial Physical Risk - AI Data Operations Analyst,2026-07-03 00:54:15+00:00,MSCI,,,Mumbai,False,False,False,False,False
5785773057,"This job is with Deutsche Bank, an inclusive employer and a member of myGwork – the largest global platform for the LGBTQ business community. Please do not contact the recruiter directly. Position Overview Corporate Title: NCT Location: Bangalore, India Role Description C&AFC C&AFC is responsible for managing the compliance and anti-financial crime risk of Deutsche Bank Group. Our mission is to ensure that C&AFC services are provided to the bank with the goals of protecting its integrity and re…",Group Data Privacy (GDP) – Data Privacy Analyst,2026-07-03 00:54:32+00:00,Deutsche Bank,,,Bangalore,False,False,False,False,False
5785770792,"This job is with Capco, an inclusive employer and a member of myGwork – the largest global platform for the LGBTQ business community. Please do not contact the recruiter directly. Job Title: Data Analyst (Python Pyspark) About Us “Capco, a Wipro company, is a global technology and management consulting firm. Awarded with Consultancy of the year in the British Bank Award and has been ranked Top 100 Best Companies for Women in India 2022 by Avtar & Seramount . With our presence across 32 cities a…",B3.1 IRR Design,2026-07-03 00:54:11+00:00,Capco,,,other/state only,True,False,False,False,False
5789116833,"About the Company Skills Outsource Think Pvt ltd is specialized as a technology partner in software development & IT consulting services in various domains. We are working for international clients located all over the world, mainly in Europe, offering outsourcing and off-shoring solutions. Job Summary We are looking for a French-speaking Project Coordinator to manage and oversee projects for international clients. This role involves close collaboration with product teams, developers, and clien…",French Project Coordinator,2026-07-05 17:34:35+00:00,Skills Agency,,,Bangalore,False,False,False,False,False
5790410804,"This job is with Kyndryl, an inclusive employer and a member of myGwork – the largest global platform for the LGBTQ business community. Please do not contact the recruiter directly. Who We Are At Kyndryl, we run and reimagine the mission-critical technology systems that drive advantage for the world's leading businesses. We are at the heart of progress; with proven expertise and a continuous flow of AI-powered insight, enabling smarter decisions, faster innovation, and a lasting competitive edg…",ServiceNow Catalog SME,2026-07-07 05:28:52+00:00,Kyndryl,,,Bangalore,False,False,False,False,False
5768015029,"About the Role We are looking for a hands-on analyst who will build, automate, and optimize operational workflows across Fund Accounting Operations. The ideal candidate is strong in Excel Macros/VBA, SQL , Power Automate , BI Publisher and Power BI , with a preference for candidates experienced in Oracle SQL and comfortable working with Wealth Spectrum (SQL-based) / Multifonds data structures. You will partner with FA Ops and Tech teams to deliver robust automation, reconciliations, and MIS/ana…",Fund Accountant,2026-06-18 15:55:07+00:00,Nuvama Asset Services,,,Mumbai,False,True,True,True,False
5790410506,"This job is with Wise, an inclusive employer and a member of myGwork – the largest global platform for the LGBTQ business community. Please do not contact the recruiter directly. Wise is a global technology company, building the best way to move and manage the world’s money. Min fees. Max ease. Full speed. Whether people and businesses are sending money to another country, spending abroad, or making and receiving international payments, Wise is on a mission to make their lives easier and save t…",Senior Analyst - Internal Audit,2026-07-07 05:28:41+00:00,Wise,,,Hyderabad,False,False,False,False,False
5768012754,"Key Responsibilities 1. Teaching & Academic Delivery Deliver engaging, high-quality lectures on core subjects such as Predictive Analytics, Data Visualization, Data Mining, Business Intelligence, and Domain-Specific Analytics (Marketing, HR, Finance). Facilitate hands-on training sessions in dedicated Data Analytics labs using live datasets and case studies. Design, develop, and regularly update course modules, lesson plans, and assessments to keep pace with emerging industry trends. 2. Technic…",Assistant Professor Business Analytics,2026-06-18 15:54:36+00:00,CHANDIGARH UNIVERSITY,,,other/state only,False,False,False,False,False
5768017754,"About the Role: As a Performance Content Writer, you will be responsible for creating unique, high-impact, and engaging content for industries like FMCG, Automobile, Telecom, and BFSI. As a core member of the Performance Content team at Performics India, you will play a fundamental role in scaling content production through a hybrid approach of human creativity and AI-powered inputs. You will learn, train, and collaborate with Content Strategists and Project Teams to ensure the delivery of high…",Content Writer,2026-06-18 15:55:49+00:00,Performics India,,,Mumbai,False,False,False,False,False
5785772951,"This job is with HP, an inclusive employer and a member of myGwork – the largest global platform for the LGBTQ business community. Please do not contact the recruiter directly. Financial Analyst-Record to Report Description - Job Summary: We are seeking a highly skilled and detail-oriented Financial Planning and Data Analyst. The ideal candidate will bring deep expertise in financial operations and business finance, along with advanced proficiency in analytical tools to drive data-driven decisi…",Financial Analyst-Record to Report,2026-07-03 00:54:31+00:00,HP,,,Bangalore,False,False,False,False,False
5792883599,"This job is with Capco, an inclusive employer and a member of myGwork – the largest global platform for the LGBTQ business community. Please do not contact the recruiter directly. Job Title: Automation Tester Location-Bangalore Exp-3 years About Us “Capco, a Wipro company, is a global technology and management consulting firm. Awarded with Consultancy of the year in the British Bank Award and has been ranked Top 100 Best Companies for Women in India 2022 by Avtar & Seramount . With our presence…",Senior Data Engineering,2026-07-08 22:17:58+00:00,Capco,,,Bangalore,False,False,False,False,False
5785771919,"This job is with Morningstar, an inclusive employer and a member of myGwork – the largest global platform for the LGBTQ business community. Please do not contact the recruiter directly. The Role: At Morningstar, helping investors is what brings us together and drives our work. We are looking for a Senior Data Engineer to join the Corporate Systems Data Enablement t eam to su pport Morningstar's Business Intelligence Reporting , grow with us, introduce us to new ideas and develop products that e…",Senior Software Engineer,2026-07-03 00:54:21+00:00,Morningstar,,,Mumbai,False,False,False,False,False
4686704238,Immediate requirement for the post of Data Analyst on rotation Shift (Male or Female). Persons only willing to work in both shifts need to apply.careers.coretechgmail.comorplease contact 9.4.nine.6.8.1.5.6.3.0,Data Analyst,2024-05-10 07:38:46+00:00,Not specified,,,Thiruvananthapuram,False,False,False,False,False
5680120020,"Role Overview We are looking for a Data Analyst with strong expertise in Microsoft Excel who can efficiently work with large datasets, formulas, and analytical models. The ideal candidate should be able to transform raw data into meaningful insights , build efficient spreadsheets, and support business decisions through structured analysis and reporting. This role requires someone who is highly detail-oriented, analytical, and extremely efficient in Excel-based data handling. Key Responsibilitie…",Data Analyst,2026-03-27 13:39:38+00:00,SkySun,,,other/state only,False,False,True,False,False
5693524382,"Position: Data Analyst Location: Mumbai, India About LRN: LRN is the world’s leading dedicated ethics and compliance SaaS company, helping more than 30 million people every year navigate complex regional and global regulatory environments and build ethical, responsible cultures. With over 3,000 clients across the US, EMEA, APAC, and Latin America—including some of the world’s most respected and successful brands—we’re proud to be the long-term partner trusted to reduce organizational risk and d…",Data Analyst,2026-04-09 01:03:12+00:00,LRN Corporation,,,other/state only,False,False,False,False,False
5793077025,"We are looking for a Data Analyst with 2–3 years of experience for a 3-month contract . You will be responsible for extracting web data, organizing it in Excel, and communicating findings clearly to our team. Role Details Duration: 3 Months Experience Required: 2–3 years Location: Vadodara Key Responsibilities Extract data from various websites using web scraping tools. Clean, organize, and analyze the collected datasets. Write database queries to pull and manage information. Present data findi…",Data Analyst,2026-07-09 02:21:15+00:00,Cloudester Software LLP,,,Vadodara,False,False,True,False,False
5701957947,"About the Role We are looking for highly analytical and detail-oriented Data Analysts from the 2026 graduating batch who are passionate about working with data and solving real-world business problems. This role will involve working across functions, applying analytics to drive data-driven decision-making. Key Responsibilities ● Extract, clean, and analyse large datasets using SQL and Python ● Perform statistical analysis to derive actionable insights, identify trends, patterns, and anomalies ●…",Data Analyst,2026-04-17 05:43:28+00:00,Time Hack Consulting,1200000.0,50000.0,Bangalore,True,True,False,False,False
5758416408,"Job Description Work Timings: 10:15 AM – 7:15 PM Working Days: Monday to Saturday (2nd, 4th & 5th Saturdays off) Work Mode: Work From Office Location: Mumbai (Lower Parel; occasional Andheri campus visits) About IIDE: IIDE is India’s leading digital business school, offering industry-relevant programs in digital marketing, AI, and business. With a strong focus on experiential learning, we equip students, graduates, and working professionals with the skills required to thrive in today’s digital-…",Data Analyst,2026-06-10 17:05:18+00:00,IIDE,,,Mumbai,False,False,False,False,False
5785716520,"Solid SQL capability (data extraction, transformation, validation) Strong data analysis skills with hands-on experience working with complex datasets Ability to manage and communicate with cross-functional stakeholders Experience in Liquidity, Treasury, and Regulatory Reporting",Data Analyst,2026-07-02 23:22:03+00:00,TalentOla,,,Bangalore,False,True,False,False,False
5786180968,"Analyzing hiring and candidate data to improve decision-making, shortlisting, and overall system efficiency. Skills: Logical/analytical thinking, Excel/Google Sheets, basic SQL, data interpretation, data visualization, attention to detail. Responsibilities: Analyze candidate and hiring data, build dashboards and reports, improve shortlisting/scoring systems, track hiring funnel metrics, work with ops/product teams, ensure data accuracy. This is a remote position.",Data Analyst,2026-07-03 06:18:29+00:00,Proof of Skill,1200000.0,1200000.0,Mumbai,False,True,True,False,False
5785732023,"Job Description Duties: Power BI Development Develop interactive, user-friendly dashboards and reports in Power BI Build effective data models using DAX and Power Query Maintain version control and documentation of dashboards Maintain / Troubleshoot existing Power BI reports/dashboards and making necessary arrangements for data refresh as per required frequencies. SQL & Data Handling Write and optimize SQL queries for data extraction, transformation, and validation Perform data validation and q…",Data Analyst,2026-07-03 00:06:49+00:00,Smiths Detection,,,Bangalore,False,True,False,True,False
5791623332,"Job Description We are hiring a Power BI Developer to support our global internal teams (Finance, HR, Strategy, Corporate Functions) by delivering high-impact business intelligence dashboards, datasets, and analytics solutions. This role is critical for strengthening our internal reporting systems and driving data-backed decision-making across the organization. Key Responsibilities Design, maintain, and enhance internal Power BI dashboards and analytics for Corporate Finance and other functions…",Data Analyst,2026-07-08 06:34:02+00:00,Sia,,,Mumbai,False,False,False,True,False
5787032313,"Job Description Job Purpose & Dimensions Ensure global master data is being maintained on a highest quality level throughout their lifecycle. Define and continuously improve and implement measures, processes and tools to control global master data consistency and enhance existing tools. Core Responsibilities Maintain and govern master data across SCM systems, ensuring data quality, consistency, and compliance with governance standards. Ensure adherence to Master Data Governance (MDG) standards,…",Data Analyst,2026-07-04 00:44:32+00:00,Renesas Electronics,,,Bangalore,False,False,False,False,False
5785732188,"Job Description Impact - Enable data-driven decisions for leaders for LiveOps events, feature launches, and content updates through dashboards by defining datasets. Track KPIs including and not limited upto - Daily Active Users (DAU), Retention Rate, Churn Rate, ARPU (Average Revenue Per User), and session metrics. Make daily / weekly/monthly reports on player behavior, performance accuracy, engagement, and monetization / revenue trends to improve visibility. Proactively identify patterns, anom…",Data Analyst,2026-07-03 00:06:50+00:00,Ubisoft,,,Pune,False,False,False,False,False
5767332879,"Job Description Skills : 4-6 years of professional relevant experience in ODI development. Strong experience with Oracle Fusion Applications as a data source. Proven track record of 2–3 ODI projects (end-to-end implementation). Proficiency in SQL, PL/SQL, and Oracle database concepts. Knowledge of ETL best practices and data warehousing principles. Ability to troubleshoot and resolve complex integration issues. Key Responsibilities: ODI Development: Design, develop, and implement ETL processes …",Data Analyst,2026-06-18 04:52:29+00:00,Sopra Steria,,,Noida,False,True,False,False,False
5790410778,"This job is with Kyndryl, an inclusive employer and a member of myGwork – the largest global platform for the LGBTQ business community. Please do not contact the recruiter directly. Who We Are At Kyndryl, we run and reimagine the mission-critical technology systems that drive advantage for the world's leading businesses. We are at the heart of progress; with proven expertise and a continuous flow of AI-powered insight, enabling smarter decisions, faster innovation, and a lasting competitive edg…","Senior Associate, Data Analysis",2026-07-07 05:28:52+00:00,Kyndryl,,,Bangalore,False,False,False,False,False
5735463452,"Job Summary - Data Analyst We are looking to hire a data analyst to join our enterprise customer solutions team. As a Data Analyst, one will take responsibility for developing reports, and troubleshooting data issues. To do well in this role you need attention to detail, past experience as a data analyst, and a deep understanding of the popular data analysis tools and databases. Data Analyst Responsibilities: ● Commissioning and decommissioning of data sets. ● Processing confidential data and i…",Data Analyst,2026-05-21 02:12:34+00:00,Digital Twin,,,Pune,False,False,False,False,False
1993882092,"Data Analyst Job Duties Data analyst responsibilities include conducting full lifecycle analysis to include requirements, activities and design. Data analysts will develop analysis and reporting capabilities. They will also monitor performance and quality control plans to identify improvements. Responsibilities Interpret data, analyze results using statistical techniques and provide ongoing reports Develop and implement databases, data collection systems, data analytics and other strategies tha…",Data Analyst,2021-02-15 04:27:43+00:00,SveltetechTechnologies Pvt Ltd,300000.0,,Delhi,False,False,False,False,False
4514376622,"Job Title: Data Analyst Job Brief: The successful candidate will turn data into information, information into insight and insight into business decisions. Data Analyst Job Duties Data analyst responsibilities include conducting full lifecycle analysis to include requirements, activities and design. Data analysts will develop analysis and reporting capabilities. They will also monitor performance and quality control plans to identify improvements. About Us We began in 2015 with an entrepreneuria…",Data Analyst,2024-01-07 15:08:07+00:00,Qrata,1200000.0,1000000.0,Delhi,False,False,False,False,False
5146507084,"Position Description Data Analyst Location: Remote/Bangalore Amicus Therapeutics is a global, patient-dedicated biotechnology company focused on discovering, developing and delivering high-quality medicines for people living with rare metabolic diseases. Position Summary Data analyst responsibilities include conducting full lifecycle analysis to include requirements, activities and design. Data analysts will develop analysis and reporting capabilities. They will also monitor performance and qua…",Data Analyst,2025-04-16 01:41:37+00:00,Amicus Therapeutics,,,Bangalore,False,False,False,False,False
